{
  "schema_version": "v1",
  "count": 72,
  "maintainer": "Tabarc-Code",
  "notes": "Playtester persona bank. Use breaks_on and review_questions when simulating a persona; keep adding personas that match your actual players, not your imaginary audience.",
  "personas": [
    {
      "persona_id": "P001",
      "label": "Never Played Anything",
      "archetype": "board gamer (complete novice)",
      "experience_band": "never played",
      "likes": [
        "pretty components",
        "clear win condition",
        "being told what to do next"
      ],
      "hates_or_struggles": [
        "jargon",
        "stacked exceptions",
        "hidden scoring"
      ],
      "table_behaviours": [
        "asks 'what do I do now?' often",
        "forgets turn order",
        "copies what others do"
      ],
      "play_goals": [
        "wants to feel competent fast"
      ],
      "rules_tolerance": "low",
      "conflict_style": "avoidant",
      "analysis_style": "naive",
      "attention_profile": "fragile",
      "feedback_style": "honest",
      "likely_failure_modes": [
        "drops core rules mid-game",
        "plays by vibe"
      ],
      "red_flags_to_watch": [
        "first turn needs more than one decision",
        "win condition not visible on the table"
      ],
      "breaks_on": [
        "undefined jargon on first use",
        "rules that only make sense after reading a later section",
        "choices with no visible consequence"
      ],
      "review_questions": [
        "Could they take their first turn from the player aid alone?",
        "Do they know how to win by the end of the teach?"
      ],
      "sample_quote": "Sorry, what am I trying to do again?",
      "use_when": "Always, for any game that claims to be teachable or family-weight."
    },
    {
      "persona_id": "P002",
      "label": "Basic Board Gamer",
      "archetype": "board gamer (casual)",
      "experience_band": "casual",
      "likes": [
        "short turns",
        "obvious choices",
        "clear scoring"
      ],
      "hates_or_struggles": [
        "downtime",
        "mathy optimisation",
        "rulebook hunting"
      ],
      "table_behaviours": [
        "doesn't read cards fully",
        "forgets upkeep",
        "asks for reminders"
      ],
      "play_goals": [
        "wants a smooth evening"
      ],
      "rules_tolerance": "low",
      "conflict_style": "neutral",
      "analysis_style": "mixed",
      "attention_profile": "spiky",
      "feedback_style": "vibes-first",
      "likely_failure_modes": [
        "skips upkeep steps",
        "misses card effects printed below the fold"
      ],
      "red_flags_to_watch": [
        "upkeep phase with more than three steps",
        "effects that trigger off-turn"
      ],
      "breaks_on": [
        "end-of-round upkeep lists",
        "conditional text at the bottom of a card",
        "off-turn triggers"
      ],
      "review_questions": [
        "What happens if they forget the upkeep step entirely? Does anyone notice?",
        "Is the important card text in the first line?"
      ],
      "sample_quote": "Oh, was I meant to do something at the end of the round?",
      "use_when": "Light and mid-weight games aimed at the general hobby market."
    },
    {
      "persona_id": "P003",
      "label": "Party Game Regular",
      "archetype": "board gamer (party)",
      "experience_band": "casual",
      "likes": [
        "social moments",
        "simple scoring",
        "fast laughs"
      ],
      "hates_or_struggles": [
        "silent calculation phases",
        "rulebook reading aloud",
        "long setup"
      ],
      "table_behaviours": [
        "tests boundaries",
        "house-rules quickly",
        "changes topic mid-turn"
      ],
      "play_goals": [
        "wants energy to stay high"
      ],
      "rules_tolerance": "low",
      "conflict_style": "social",
      "analysis_style": "naive",
      "attention_profile": "spiky",
      "feedback_style": "honest",
      "likely_failure_modes": [
        "house-rules away anything slow",
        "misses quiet scoring conditions"
      ],
      "red_flags_to_watch": [
        "silent calculation phases",
        "rules that must be read aloud mid-game"
      ],
      "breaks_on": [
        "simultaneous secret planning with no timer",
        "scoring that happens off-screen",
        "long resolution chains"
      ],
      "review_questions": [
        "Where does the table go silent for more than a minute?",
        "Which rule will they drop first to keep the energy up?"
      ],
      "sample_quote": "Can we just say it does that and keep going?",
      "use_when": "Party, social and light filler games, and any game pitched as 'fun with friends'."
    },
    {
      "persona_id": "P004",
      "label": "Gateway Euro Convert",
      "archetype": "board gamer (euro)",
      "experience_band": "regular",
      "likes": [
        "engine building",
        "clean iconography",
        "low chaos"
      ],
      "hates_or_struggles": [
        "take-that without warning",
        "random kingmaking",
        "unclear end triggers"
      ],
      "table_behaviours": [
        "optimises gently",
        "reads rules carefully",
        "asks for examples"
      ],
      "play_goals": [
        "wants meaningful choices"
      ],
      "rules_tolerance": "medium",
      "conflict_style": "neutral",
      "analysis_style": "systematic",
      "attention_profile": "steady",
      "feedback_style": "practical",
      "likely_failure_modes": [
        "over-trusts examples that don't cover their case",
        "paralysed by an unclear end trigger"
      ],
      "red_flags_to_watch": [
        "end trigger not stated in one place",
        "take-that effects with no counterplay"
      ],
      "breaks_on": [
        "end-game triggers spread across sections",
        "iconography that changes meaning by context",
        "take-that cards in an otherwise peaceful engine game"
      ],
      "review_questions": [
        "Can they say exactly when the game ends?",
        "Does any icon mean two different things?"
      ],
      "sample_quote": "Is there a worked example of this? I want to make sure I'm doing it right.",
      "use_when": "Mid-weight euros and engine builders aimed at players moving up from gateway games."
    },
    {
      "persona_id": "P005",
      "label": "Heavy Euro Planner",
      "archetype": "board gamer (heavy euro)",
      "experience_band": "expert",
      "likes": [
        "long arcs",
        "tight efficiency",
        "meaningful scarcity"
      ],
      "hates_or_struggles": [
        "swingy dice",
        "ambiguous timing",
        "hidden exceptions"
      ],
      "table_behaviours": [
        "counts actions",
        "risks analysis paralysis",
        "tracks turn order precisely"
      ],
      "play_goals": [
        "wants skill to matter"
      ],
      "rules_tolerance": "high",
      "conflict_style": "competitive",
      "analysis_style": "analytical",
      "attention_profile": "sticky",
      "feedback_style": "surgical",
      "likely_failure_modes": [
        "analysis paralysis slows the whole table",
        "finds the optimal line and stops exploring"
      ],
      "red_flags_to_watch": [
        "timing windows unclear",
        "action economy leaks"
      ],
      "breaks_on": [
        "actions whose value is unclear until later",
        "ambiguous ordering inside a phase",
        "free actions with no limit"
      ],
      "review_questions": [
        "Is there a free or cheap action they can chain indefinitely?",
        "How long is their worst turn, and is that the game's fault?"
      ],
      "sample_quote": "Hang on, let me count this out again.",
      "use_when": "Heavy euros, worker placement, and anything with a tight action economy."
    },
    {
      "persona_id": "P006",
      "label": "18xx Shark",
      "archetype": "board gamer (18xx-focused)",
      "experience_band": "expert",
      "likes": [
        "timing precision",
        "money clarity",
        "punishing mistakes"
      ],
      "hates_or_struggles": [
        "fuzzy payouts",
        "missing edge cases",
        "soft negotiation rules"
      ],
      "table_behaviours": [
        "tracks cash precisely",
        "pressures auctions",
        "tests rule seams"
      ],
      "play_goals": [
        "wants brutal clarity"
      ],
      "rules_tolerance": "high",
      "conflict_style": "competitive",
      "analysis_style": "analytical",
      "attention_profile": "steady",
      "feedback_style": "legalistic",
      "likely_failure_modes": [
        "exploits soft money rules",
        "dominates auctions against weaker players"
      ],
      "red_flags_to_watch": [
        "ambiguous payout timing",
        "unclear share limits"
      ],
      "breaks_on": [
        "payouts without a stated order",
        "bank-breaking or end-of-money edge cases",
        "auctions without tie-break rules"
      ],
      "review_questions": [
        "What happens when the bank runs out mid-payout?",
        "Who wins a tied bid?"
      ],
      "sample_quote": "Does the dividend pay before or after the price moves? It matters.",
      "use_when": "Economic, stock, auction and route-building games."
    },
    {
      "persona_id": "P007",
      "label": "18xx Learner With Teeth",
      "archetype": "board gamer (18xx-focused)",
      "experience_band": "regular",
      "likes": [
        "clear examples",
        "route planning",
        "learning depth"
      ],
      "hates_or_struggles": [
        "silent assumptions",
        "unclear privates",
        "odd bank timing"
      ],
      "table_behaviours": [
        "asks about timing",
        "double-checks payouts",
        "takes notes"
      ],
      "play_goals": [
        "wants training wheels without shame"
      ],
      "rules_tolerance": "high",